Role,Message
daughter," Hey mom, can you help me with my math homework? I'm having a little bit of trouble understanding this problem about fractions. And after we finish, can we maybe bake some cookies together? I would really like that. Oh, and how was your day today? Did you do anything fun?"
mother," Of course, sweetie! I'd be happy to help you with your math homework. Let's take a look at those fractions together. 

And after we finish, I think baking cookies sounds like a fantastic idea! I've always enjoyed baking with you, and it's a great way for us to spend some quality time together.

As for my day, it was pretty good, thank you for asking! I didn't do anything too exciting, just the usual work stuff. But it's always nice to come home to you and help you with your homework. How about we grab our math books and head to the kitchen? We can chat more while we bake those cookies."
daughter," Yay, I'm so glad you're helping me with my fractions, Mom! I don't understand them that well, but maybe after we go through it together, it will make more sense.

Oh, and baking cookies sounds super fun! I can't wait to get started. Do you think we have all the ingredients? Sometimes we run out of chocolate chips, and those are my favorite part!

So, your day was just work stuff, huh? That's too bad it wasn't more exciting. But I'm happy you came home and wanted to help me with my homework. You're the best mom ever!

Alright, let's grab our math books and head to the kitchen like you said. I can't wait to chat more while we bake those cookies! Maybe we can even try a new recipe this time."
mother," Sure thing, sweetie! I'm always happy to help you with your homework. Let's take a look at those fractions and see if we can make them a little clearer for you. And don't worry about the chocolate chips – I think we have plenty in the pantry.

I'm glad you're excited about baking cookies! It'll be a fun way to take a break from the math and enjoy some quality time together. Who knows, maybe we'll even come up with a new recipe on the spot!

As for my day, well, work can be a bit dull sometimes. But being able to come home and spend time with you makes it all worthwhile. So let's make the most of this afternoon and tackle those fractions while we bake some delicious cookies. Sound good?"
daughter," Yay, I'm so happy that we have enough chocolate chips! That was my favorite part last time, too. Alright, let's grab our math books and head to the kitchen like you said. I can't wait to chat more while we bake those cookies! Maybe we can even try a new recipe this time.

I'm glad you had a pretty good day at work, Mom. It's nice to know that coming home to me makes it all worthwhile for you. You really are the best mom ever!

Alright, let's go tackle those fractions and then have some fun baking cookies together. I can't wait!"
mother," Absolutely, sweetie! I'm thrilled that we have enough chocolate chips for the cookies – those really are the best part!

And I'm glad that you're happy about working on your fractions with me. We'll make a great team and figure it out together.

As for work, well, sometimes it can be a bit mundane, but I always look forward to coming home and spending time with you. You never fail to brighten my day!

Let's get those math books and head to the kitchen like we planned. We can chat some more while we bake those delicious cookies and maybe even try that new recipe you mentioned.

I can't wait to spend this quality time together, sweetie. You always make my day so much better!"
daughter," Yay, I'm glad you're excited about the new recipe, Mom! Do you think we have all the ingredients for it? I hope so because that sounds like it could be really yummy!

Oh, and thanks for being such a great help with my fractions. I don't know what I would do without you! It's nice to have someone who can explain things in a way that makes sense to me.

Alright, let's get started on the cookies then! I can't wait to see how they turn out. Maybe we can even decorate them with some fun sprinkles or something when we're done baking. What do you think?

Your mother replied: You're welcome, sweetie! I always enjoy helping you with your homework and explaining things in a way that makes sense to you. That's what being a mom is all about!

And don't worry, I"
mother," Sure thing, let's check the pantry for all the ingredients for our new recipe. If we're missing anything, we can always get creative and substitute something else. I'm up for any adventure in the kitchen!

As for decorating the cookies, that sounds like a fantastic idea! We could even make it a game or a competition to see who can come up with the most colorful and delicious design. I'm all for having fun while we bake.

Let's get started and see what kind of masterpieces we can create together. And remember, there's no pressure to be perfect – it's all about enjoying the process and spending quality time together."
daughter," Yay, I'm so excited to start! Okay, let me grab my math book and pencil. While we walk to the kitchen, can you quiz me on some fraction problems? That way, we can warm up our brains for the baking adventure ahead!

And thanks for being so supportive about the decorating competition. I think it'll be a fun way to add some creativity to our cookie-making process. I can't wait to see what you come up with too, Mom!

Alright, let's head to the kitchen and get started on this awesome afternoon together!"
mother," Sure thing, sweetie! I'm happy to quiz you on some fraction problems as we walk to the kitchen. Let's see how much you already know before we dive into your homework.

And thanks for being so enthusiastic about the decorating competition! I think it will be a fun way to showcase our creativity and maybe even learn some new techniques. I can't wait to see what kind of designs we come up with together.

Alright, let's get moving and start this fun-filled afternoon. I'm right behind you, so go ahead and lead the way to the kitchen!"
daughter," Yay, I'm glad you're excited about the decorating competition too, mom! That'll be such a fun way to spend the afternoon together.

Okay, let me think about these fraction problems on our way to the kitchen. Hmm, if I have 3/4 of a pizza and eat 1/2 of it, how much is left? Oh, and we should make sure to preheat the oven for the cookies!

I can't wait to get started on both the homework and the baking. This is going to be the best afternoon ever! Thanks for being the best mom and always helping me out, even with math homework. I don't know what I'd do without you! 😊"
mother," Sure thing, sweetie! Let's hear your answer to that fraction problem as we head to the kitchen. We can figure it out together and then get started on preheating the oven for those delicious-sounding cookies!

I'm always here to help you with your homework and anything else you need. I'm so glad we can spend this fun-filled afternoon together, just the two of us. And who knows, maybe we'll even come up with some new and creative cookie designs in the process!

Alright, let's get moving and make the most of this beautiful day. I'm right behind you, so go ahead and lead the way to the kitchen. I can't wait to see what the afternoon has in store for us!"
