Role,Message
daughter," Hey mom, can you help me with my math homework? I'm having a little trouble understanding this problem about fractions. And by the way, did you see that cute puppy on our walk today? I wanted to pet it so bad! Do you think we can get a dog soon?"
mother," Sure, I can try to help you with your math homework. Let's take a look at the problem and see if we can figure it out together. As for the puppy, I don't remember seeing one on our walk today. But I understand how you feel, they can be really cute! As for getting a dog, we'll have to see. It's a big responsibility and we need to make sure we're ready for it."
daughter," Okay, thanks mom! So for this math problem, do I convert the fractions to decimals or something? And even if you didn't see the puppy, I still thought it was super cute! I hope we can get a dog soon, maybe we could start by volunteering at an animal shelter so I can learn more about taking care of them. Do you think that's a good idea?"
mother," Sure thing, let's work on the math problem first. To convert fractions to decimals, you can divide the numerator (top number) by the denominator (bottom number). As for the puppy and volunteering at an animal shelter, that could be a good way to learn more about taking care of animals. But remember, getting a pet is a big responsibility and we need to make sure we're ready for it before making any decisions."
daughter," Okay, thanks for explaining that to me! So if I want to convert 1/2 to a decimal, I would divide 1 by 2, right? That gives me 0.5. Yay, I got it! Can we do another problem now?

And about the volunteering at an animal shelter, I really think it's a good idea. I promise I will help take care of the pet and not just leave all the work to you. Do you think we can go check out some animal shelters this weekend?"
mother," Sure thing! I'm glad you were able to figure out the math problem with my help. Let's move on to another one and see how it goes.

As for volunteering at an animal shelter, that sounds like a good idea and I appreciate your willingness to help take care of a pet if we do decide to get one. We can definitely go check out some shelters this weekend and see what they have to offer. Just remember that it's important to be patient and take the time to find the right fit for our family."
daughter," Yay, I'm so excited to volunteer at an animal shelter! Can we also learn about different types of dogs while we're there? I think it would be fun to know which breeds we might like to have as a pet. And thanks for helping me with the math problems, mom. Let's do another one now!"
mother," Sure thing, let's try another math problem. And I suppose learning about different types of dogs at the animal shelter is a good idea. It could help us make an informed decision if we do decide to get a pet. Just remember to keep an open mind and not get too attached to any one dog just yet."
daughter," Okay, thanks mom! So for this math problem, I have to add 3/4 and 1/2 together. Do I convert them to decimals first or can I add them as fractions?

And I'll definitely try to keep an open mind at the animal shelter. But it's so hard not to get attached when they're all just so cute! Maybe we could even take some pictures of our favorites to help us remember which ones we liked. What do you think?"
mother," Sure thing, let's work on that math problem together. You can actually add fractions as long as the denominators (the bottom numbers) are the same. In this case, 3/4 and 1/2 have different denominators, so we need to find a common denominator. The least common multiple of 4 and 2 is 4, so let's make the second fraction into a fourth. To do that, we multiply both the numerator (top number) and the denominator by 2: 1/2 x 2/2 = 2/4. Now that both fractions have the same denominator, you can add them together: 3/4 + 2/4 = 5/4.

As for the animal shelter, I understand it's hard not to get attached to the animals there. Taking pictures of your favorites is a good idea to help you remember which ones you liked. Just"
daughter," Oh, okay! So if I understand correctly, I can add 3/4 and 1/2 by making the second fraction into fourths, so it becomes 2/4, and then adding them together gives me 5/4. That's pretty cool!

And yay, taking pictures at the animal shelter is a great idea! I can't wait to go there this weekend and learn more about different types of dogs. Do you think we can also play with some of them while we're there? I would love to see how they interact with people."
mother," Sure, we can definitely try to play with some of the dogs at the animal shelter. It's important to ask the staff first and make sure it's okay, but I think it would be a great way to learn more about them. I'm looking forward to our visit this weekend too! And I'm glad you were able to understand how to add those fractions together. If you have any more math questions, just let me know and I'll do my best to help. Have a good night!"
